{
  "generated_at": "2026-06-30T13:57:10.613330+00:00",
  "schema_version": "coverage-matrix-v1.0.0",
  "stale_ac_refs": [],
  "summary": {
    "active_acs": 114,
    "coverage_pct": 8.8,
    "covered_acs": 10,
    "total_acs": 121,
    "total_user_stories": 31
  },
  "unlinked_tests": [],
  "user_stories": [
    {
      "acceptance_criteria": [
        {
          "coverage": {
            "status": "not_covered",
            "test_count": 0,
            "tests": []
          },
          "description": "User can see the domains they have access to on the dashboard.",
          "id": "US-2-01",
          "state": "Active",
          "version": "v1.4.2"
        },
        {
          "coverage": {
            "status": "not_covered",
            "test_count": 0,
            "tests": []
          },
          "description": "Dashboard displays an empty state message when no domains are accessible to the user.",
          "id": "US-2-02",
          "state": "Active",
          "version": "v1.8.2"
        },
        {
          "coverage": {
            "status": "not_covered",
            "test_count": 0,
            "tests": []
          },
          "description": "Each domain card displays: name, creation date, primary owner, and classification.",
          "id": "US-2-03",
          "state": "Active",
          "version": "v1.8.2"
        },
        {
          "coverage": {
            "status": "not_covered",
            "test_count": 0,
            "tests": []
          },
          "description": "The dashboard shows three separate domain carousels: recently visited domains, primary owned domains, and draft domains.",
          "id": "US-2-04",
          "state": "Active",
          "version": "v1.9.0"
        },
        {
          "coverage": {
            "status": "not_covered",
            "test_count": 0,
            "tests": []
          },
          "description": "Each domain card on the dashboard exposes a More Actions menu with context-sensitive options: owned domains additionally show \"Grant access\" and \"Edit domain\"; all cards show \"View data feeds\", \"View statistics\", \"View questions\", and \"Survivorship\".",
          "id": "US-2-05",
          "state": "Active",
          "version": "v1.9.0"
        },
        {
          "coverage": {
            "status": "not_covered",
            "test_count": 0,
            "tests": []
          },
          "description": "Each domain card on the dashboard shows the count of pending access requests and open questions for that domain.",
          "id": "US-2-06",
          "state": "Active",
          "version": "v1.9.0"
        },
        {
          "coverage": {
            "status": "not_covered",
            "test_count": 0,
            "tests": []
          },
          "description": "A \"View all domains\" button on the dashboard navigates the user to the full Domain Catalogue page.",
          "id": "US-2-07",
          "state": "Active",
          "version": "v1.9.0"
        },
        {
          "coverage": {
            "status": "not_covered",
            "test_count": 0,
            "tests": []
          },
          "description": "The dashboard toolbar provides \"Create Domain\" and \"Import domain\" buttons that launch the respective flows without leaving the dashboard.",
          "id": "US-2-08",
          "state": "Active",
          "version": "v1.9.0"
        }
      ],
      "full_id": "absa-group/unify-living-documentation/US-2",
      "id": "US-2",
      "state": "active",
      "summary": {
        "active_acs": 8,
        "coverage_pct": 0.0,
        "covered_acs": 0,
        "total_acs": 8
      },
      "title": "View Dashboard"
    },
    {
      "acceptance_criteria": [
        {
          "coverage": {
            "status": "not_covered",
            "test_count": 0,
            "tests": []
          },
          "description": "User can edit fields such as owner tab, type of domain, target dataset, classification, Availability and schedule.",
          "id": "US-9-01",
          "state": "Active",
          "version": "v1.5.0"
        },
        {
          "coverage": {
            "status": "not_covered",
            "test_count": 0,
            "tests": []
          },
          "description": "User cannot edit fields such domain name, type of domain and country code after creation of data feed.",
          "id": "US-9-02",
          "state": "Active",
          "version": "v1.5.0"
        }
      ],
      "full_id": "absa-group/unify-living-documentation/US-9",
      "id": "US-9",
      "state": "active",
      "summary": {
        "active_acs": 2,
        "coverage_pct": 0.0,
        "covered_acs": 0,
        "total_acs": 2
      },
      "title": "Edit Data Feeds"
    },
    {
      "acceptance_criteria": [
        {
          "coverage": {
            "status": "not_covered",
            "test_count": 0,
            "tests": []
          },
          "description": "User can access the data feeds details.",
          "id": "US-18-01",
          "state": "Active",
          "version": "v1.4.2"
        },
        {
          "coverage": {
            "status": "not_covered",
            "test_count": 0,
            "tests": []
          },
          "description": "The user can see all data feeds across all domains, regardless of ownership.",
          "id": "US-18-02",
          "state": "Active",
          "version": "v1.4.3"
        },
        {
          "coverage": {
            "status": "not_covered",
            "test_count": 0,
            "tests": []
          },
          "description": "Data feed detail view displays: name, description, availability status, and tabs for About, Data sources, Mapping, and Version management.",
          "id": "US-18-03",
          "state": "Active",
          "version": "v1.8.2"
        }
      ],
      "full_id": "absa-group/unify-living-documentation/US-18",
      "id": "US-18",
      "state": "active",
      "summary": {
        "active_acs": 3,
        "coverage_pct": 0.0,
        "covered_acs": 0,
        "total_acs": 3
      },
      "title": "View Data Feed"
    },
    {
      "acceptance_criteria": [
        {
          "coverage": {
            "status": "not_covered",
            "test_count": 0,
            "tests": []
          },
          "description": "The user must capture all mandatory fields.",
          "id": "US-3-01",
          "state": "Active",
          "version": "v1.5.0"
        },
        {
          "coverage": {
            "status": "not_covered",
            "test_count": 0,
            "tests": []
          },
          "description": "The user can import the data source from a file or from a Glue table when.",
          "id": "US-3-02",
          "state": "Active",
          "version": "v1.5.0"
        }
      ],
      "full_id": "absa-group/unify-living-documentation/US-3",
      "id": "US-3",
      "state": "active",
      "summary": {
        "active_acs": 2,
        "coverage_pct": 0.0,
        "covered_acs": 0,
        "total_acs": 2
      },
      "title": "Add Data Feeds"
    },
    {
      "acceptance_criteria": [
        {
          "coverage": {
            "status": "not_covered",
            "test_count": 0,
            "tests": []
          },
          "description": "User can delete data feeds.",
          "id": "US-6-01",
          "state": "Active",
          "version": "v1.5.0"
        },
        {
          "coverage": {
            "status": "not_covered",
            "test_count": 0,
            "tests": []
          },
          "description": "User is prompted with a confirmation dialog before data feed deletion.",
          "id": "US-6-02",
          "state": "Active",
          "version": "v1.8.2"
        },
        {
          "coverage": {
            "status": "not_covered",
            "test_count": 0,
            "tests": []
          },
          "description": "A user who does not own the data feed cannot delete it.",
          "id": "US-6-03",
          "state": "Active",
          "version": "v1.8.2"
        }
      ],
      "full_id": "absa-group/unify-living-documentation/US-6",
      "id": "US-6",
      "state": "active",
      "summary": {
        "active_acs": 3,
        "coverage_pct": 0.0,
        "covered_acs": 0,
        "total_acs": 3
      },
      "title": "Delete Data Feeds"
    },
    {
      "acceptance_criteria": [
        {
          "coverage": {
            "status": "not_covered",
            "test_count": 0,
            "tests": []
          },
          "description": "User can search data feed by name or partial name.",
          "id": "US-12-01",
          "state": "Active",
          "version": "v1.5.0"
        },
        {
          "coverage": {
            "status": "not_covered",
            "test_count": 0,
            "tests": []
          },
          "description": "Each data feed from search results displays its details such as data feed name, description, and the domain it belongs to.",
          "id": "US-12-02",
          "state": "Active",
          "version": "v1.5.0"
        }
      ],
      "full_id": "absa-group/unify-living-documentation/US-12",
      "id": "US-12",
      "state": "active",
      "summary": {
        "active_acs": 2,
        "coverage_pct": 0.0,
        "covered_acs": 0,
        "total_acs": 2
      },
      "title": "Search Data Feeds"
    },
    {
      "acceptance_criteria": [
        {
          "coverage": {
            "status": "not_covered",
            "test_count": 0,
            "tests": []
          },
          "description": "The user can directly approve or reject the domain access request.",
          "id": "US-24-01",
          "state": "Active",
          "version": "v1.5.0"
        },
        {
          "coverage": {
            "status": "not_covered",
            "test_count": 0,
            "tests": []
          },
          "description": "Only the domain owner can directly grant or reject access.",